{
  "schema_version": "1.0.0",
  "session": {
    "session_id": "B2C3D4E5-F6G7-8901-2345-678901BCDEFG",
    "parent_agent_id": "backend-agent",
    "timestamp": "2025-07-12T11:15:00.000Z",
    "agent_chain": [
      {
        "agent_id": "tech-lead-tony",
        "start_time": "2025-07-12T10:00:00.000Z",
        "end_time": "2025-07-12T10:30:00.000Z",
        "completion_status": "handed_off",
        "tasks_completed": [
          "Analyzed project requirements",
          "Created implementation strategy"
        ]
      },
      {
        "agent_id": "backend-agent",
        "start_time": "2025-07-12T10:30:00.000Z",
        "end_time": "2025-07-12T11:15:00.000Z",
        "completion_status": "handed_off",
        "tasks_completed": [
          "Implemented JWT validation middleware",
          "Created comprehensive unit tests",
          "Added TypeScript type definitions",
          "Updated security module integration"
        ]
      }
    ]
  },
  "task_context": {
    "current_task": {
      "id": "T.001.01.01.01",
      "title": "Implement JWT token validation middleware",
      "description": "Create secure JWT token validation middleware with proper error handling and security best practices",
      "status": "completed",
      "priority": "high",
      "estimated_duration": 1800,
      "actual_duration": 2700
    },
    "task_hierarchy": {
      "epic": {
        "id": "E.001",
        "title": "Security Infrastructure Implementation",
        "description": "Comprehensive security framework implementation for Tony-NG"
      },
      "feature": {
        "id": "F.001.01",
        "title": "Authentication & Authorization System"
      },
      "story": {
        "id": "S.001.01.01",
        "title": "JWT Token Management"
      },
      "current_path": [
        "E.001",
        "F.001.01",
        "S.001.01.01",
        "T.001.01.01.01"
      ]
    },
    "dependencies": {
      "blocking": [],
      "blocked_by": [
        "T.001.01.01.02",
        "T.001.01.01.03"
      ],
      "related": [
        "T.001.01.02.01",
        "T.001.02.01.01"
      ]
    },
    "phase_info": {
      "current_phase": "phase-1",
      "phase_status": "qa",
      "phase_completion_percentage": 75
    }
  },
  "project_state": {
    "working_directory": "/home/jwoltje/src/tony-ng",
    "modified_files": [
      {
        "path": "backend/src/security/jwt-validation.middleware.ts",
        "status": "created",
        "size_change": 2845,
        "checksum": "sha256:a1b2c3d4e5f6789012345678901234567890abcdef1234567890abcdef123456"
      },
      {
        "path": "backend/src/security/security.module.ts",
        "status": "modified",
        "size_change": 127,
        "checksum": "sha256:b2c3d4e5f6g7890123456789012345678901bcdef23456789012cdef1234567"
      },
      {
        "path": "backend/test/security/jwt-validation.spec.ts",
        "status": "created",
        "size_change": 3421,
        "checksum": "sha256:c3d4e5f6g7h8901234567890123456789012cdef345678901def12345678901"
      }
    ],
    "git_status": {
      "branch": "feature/security-implementation",
      "commit_hash": "441e5ca7b2d1f3e8a9c4d5e6f7g8h9i0j1k2l3m4",
      "is_clean": false,
      "staged_files": [],
      "unstaged_files": [
        "backend/src/security/jwt-validation.middleware.ts",
        "backend/src/security/security.module.ts",
        "backend/test/security/jwt-validation.spec.ts"
      ],
      "untracked_files": []
    },
    "environment": {
      "node_version": "v18.17.0",
      "npm_version": "9.6.7",
      "os": "Linux 6.1.0-37-amd64",
      "shell": "/bin/bash",
      "docker_available": true
    },
    "build_status": {
      "last_build_time": "2025-07-12T11:10:00.000Z",
      "build_success": true,
      "build_errors": []
    }
  },
  "execution_context": {
    "model_selection": {
      "current_model": "sonnet",
      "reason": "QA validation suitable for Sonnet model capabilities",
      "complexity_level": "moderate"
    },
    "tool_authorizations": [
      "Read",
      "Bash",
      "Grep",
      "Glob",
      "TodoWrite"
    ],
    "constraints": {
      "timeout_minutes": 20,
      "max_files_to_modify": 2,
      "forbidden_operations": [
        "git_push",
        "npm_publish"
      ],
      "required_validations": [
        "build_success",
        "tests_pass",
        "lint_clean",
        "security_scan"
      ]
    },
    "resource_limits": {
      "max_concurrent_operations": 2,
      "memory_limit_mb": 1024,
      "disk_space_limit_mb": 512
    }
  },
  "handoff_instructions": {
    "next_agent_type": "qa-agent",
    "continuation_point": "Validate JWT middleware implementation meets all security and quality requirements",
    "success_criteria": [
      {
        "criterion": "All unit tests pass with 100% coverage",
        "validation_method": "automated_test",
        "target_value": "100% test coverage",
        "priority": "required"
      },
      {
        "criterion": "Integration tests validate middleware behavior",
        "validation_method": "automated_test",
        "target_value": "All integration scenarios pass",
        "priority": "required"
      },
      {
        "criterion": "Security scan shows no vulnerabilities",
        "validation_method": "automated_test",
        "target_value": "Zero security issues",
        "priority": "required"
      },
      {
        "criterion": "Performance meets latency requirements",
        "validation_method": "automated_test",
        "target_value": "<100ms response time",
        "priority": "required"
      },
      {
        "criterion": "TypeScript compilation with zero errors",
        "validation_method": "build_check",
        "target_value": "Clean TypeScript build",
        "priority": "required"
      },
      {
        "criterion": "ESLint validation passes",
        "validation_method": "automated_test",
        "target_value": "Zero linting errors",
        "priority": "required"
      }
    ],
    "context_files": [
      {
        "path": "backend/src/security/jwt-validation.middleware.ts",
        "purpose": "Primary implementation to validate",
        "sections": ["main validation logic", "error handling", "type definitions"]
      },
      {
        "path": "backend/test/security/jwt-validation.spec.ts",
        "purpose": "Test coverage and validation scenarios",
        "sections": ["test cases", "coverage report", "edge cases"]
      },
      {
        "path": "docs/security/testing-requirements.md",
        "purpose": "QA validation standards and criteria"
      },
      {
        "path": "package.json",
        "purpose": "Available test scripts and dependencies",
        "sections": ["scripts", "devDependencies"]
      }
    ],
    "warnings": [
      {
        "type": "security",
        "message": "Verify JWT secrets are properly handled in test environment",
        "severity": "high"
      },
      {
        "type": "performance",
        "message": "Monitor memory usage during stress testing - JWT validation can be memory intensive",
        "severity": "medium"
      },
      {
        "type": "compatibility",
        "message": "Ensure middleware is compatible with existing authentication flow",
        "severity": "high"
      }
    ]
  },
  "evidence_tracking": {
    "test_results": {
      "unit_tests": {
        "total": 24,
        "passed": 24,
        "failed": 0,
        "coverage_percentage": 100,
        "last_run": "2025-07-12T11:12:00.000Z"
      },
      "integration_tests": {
        "total": 8,
        "passed": 8,
        "failed": 0,
        "last_run": "2025-07-12T11:13:00.000Z"
      }
    },
    "coverage_metrics": {
      "line_coverage": 100,
      "branch_coverage": 100,
      "function_coverage": 100,
      "statement_coverage": 100
    },
    "validation_status": {
      "overall_status": "passed",
      "build_status": "success",
      "lint_status": "clean",
      "type_check_status": "passed",
      "security_scan_status": "not_run",
      "last_validation": "2025-07-12T11:14:00.000Z"
    },
    "artifacts": [
      {
        "type": "coverage",
        "path": "coverage/jwt-validation-coverage.html",
        "size_bytes": 15432,
        "created_at": "2025-07-12T11:12:30.000Z"
      },
      {
        "type": "test_results",
        "path": "test-evidence/jwt-validation-results.xml",
        "size_bytes": 3241,
        "created_at": "2025-07-12T11:13:15.000Z"
      }
    ]
  },
  "metadata": {
    "context_size_bytes": 4567,
    "token_count_estimate": 2456,
    "created_by": "backend-agent",
    "validated": true,
    "validation_errors": [],
    "tags": [
      "security",
      "jwt",
      "middleware",
      "implemented",
      "qa-ready",
      "implementation-handoff"
    ]
  }
}