{
  "schema_version": "1.0.0",
  "session": {
    "session_id": "A1B2C3D4-E5F6-7890-1234-567890ABCDEF",
    "parent_agent_id": "tech-lead-tony",
    "timestamp": "2025-07-12T10:30:00.000Z",
    "agent_chain": [
      {
        "agent_id": "tech-lead-tony",
        "start_time": "2025-07-12T10:00:00.000Z",
        "end_time": "2025-07-12T10:30:00.000Z",
        "completion_status": "handed_off",
        "tasks_completed": [
          "Analyzed project requirements",
          "Created implementation strategy",
          "Defined success criteria",
          "Prepared context handoff"
        ]
      }
    ]
  },
  "task_context": {
    "current_task": {
      "id": "T.001.01.01.01",
      "title": "Implement JWT token validation middleware",
      "description": "Create secure JWT token validation middleware with proper error handling and security best practices",
      "status": "pending",
      "priority": "high",
      "estimated_duration": 1800
    },
    "task_hierarchy": {
      "epic": {
        "id": "E.001",
        "title": "Security Infrastructure Implementation",
        "description": "Comprehensive security framework implementation for Tony-NG"
      },
      "feature": {
        "id": "F.001.01",
        "title": "Authentication & Authorization System"
      },
      "story": {
        "id": "S.001.01.01",
        "title": "JWT Token Management"
      },
      "current_path": [
        "E.001",
        "F.001.01", 
        "S.001.01.01",
        "T.001.01.01.01"
      ]
    },
    "dependencies": {
      "blocking": [],
      "blocked_by": [
        "T.001.01.01.02",
        "T.001.01.01.03"
      ],
      "related": [
        "T.001.01.02.01",
        "T.001.02.01.01"
      ]
    },
    "phase_info": {
      "current_phase": "phase-1",
      "phase_status": "planning",
      "phase_completion_percentage": 25
    }
  },
  "project_state": {
    "working_directory": "/home/jwoltje/src/tony-ng",
    "modified_files": [],
    "git_status": {
      "branch": "feature/security-implementation",
      "commit_hash": "441e5ca7b2d1f3e8a9c4d5e6f7g8h9i0j1k2l3m4",
      "is_clean": true,
      "staged_files": [],
      "unstaged_files": [],
      "untracked_files": []
    },
    "environment": {
      "node_version": "v18.17.0",
      "npm_version": "9.6.7",
      "os": "Linux 6.1.0-37-amd64",
      "shell": "/bin/bash",
      "docker_available": true
    },
    "build_status": {
      "last_build_time": "2025-07-12T09:45:00.000Z",
      "build_success": true,
      "build_errors": []
    }
  },
  "execution_context": {
    "model_selection": {
      "current_model": "sonnet",
      "reason": "Standard implementation task suitable for Sonnet model",
      "complexity_level": "moderate"
    },
    "tool_authorizations": [
      "Read",
      "Edit", 
      "MultiEdit",
      "Write",
      "Bash",
      "Grep",
      "Glob",
      "TodoWrite"
    ],
    "constraints": {
      "timeout_minutes": 30,
      "max_files_to_modify": 5,
      "forbidden_operations": [
        "git_push",
        "npm_publish"
      ],
      "required_validations": [
        "build_success",
        "tests_pass",
        "lint_clean"
      ]
    },
    "resource_limits": {
      "max_concurrent_operations": 3,
      "memory_limit_mb": 2048,
      "disk_space_limit_mb": 1024
    }
  },
  "handoff_instructions": {
    "next_agent_type": "backend-agent",
    "continuation_point": "Begin implementation of JWT validation middleware in backend/src/security/jwt-validation.middleware.ts",
    "success_criteria": [
      {
        "criterion": "JWT middleware validates tokens correctly",
        "validation_method": "automated_test",
        "target_value": "100% test coverage",
        "priority": "required"
      },
      {
        "criterion": "Proper error handling for invalid tokens",
        "validation_method": "automated_test",
        "target_value": "All error scenarios covered",
        "priority": "required"
      },
      {
        "criterion": "Security best practices implemented",
        "validation_method": "manual_verification",
        "target_value": "Security checklist complete",
        "priority": "required"
      },
      {
        "criterion": "TypeScript compilation succeeds",
        "validation_method": "build_check",
        "target_value": "Zero TypeScript errors",
        "priority": "required"
      }
    ],
    "context_files": [
      {
        "path": "backend/src/security/security.module.ts",
        "purpose": "Understand existing security module structure",
        "sections": ["imports", "providers", "exports"]
      },
      {
        "path": "backend/src/modules/auth/strategies/jwt.strategy.ts",
        "purpose": "Review existing JWT strategy implementation",
        "sections": ["validation logic", "error handling"]
      },
      {
        "path": "docs/security/authentication-requirements.md",
        "purpose": "Security requirements and compliance standards"
      }
    ],
    "warnings": [
      {
        "type": "security",
        "message": "Ensure JWT secrets are never logged or exposed in error messages",
        "severity": "critical"
      },
      {
        "type": "performance",
        "message": "JWT validation should complete within 100ms for optimal performance",
        "severity": "medium"
      }
    ]
  },
  "evidence_tracking": {
    "validation_status": {
      "overall_status": "not_validated",
      "build_status": "success",
      "lint_status": "clean",
      "type_check_status": "passed",
      "security_scan_status": "not_run"
    }
  },
  "metadata": {
    "context_size_bytes": 3245,
    "token_count_estimate": 1823,
    "created_by": "tech-lead-tony",
    "validated": true,
    "validation_errors": [],
    "tags": [
      "security",
      "jwt",
      "middleware",
      "backend",
      "planning-handoff"
    ]
  }
}